{
  "version": 1,
  "updated": "2026-07-18",
  "per_config_calls": 8,
  "note_en": "Per-call USD ranges observed while building this dataset (N=4 slots x 2 prompt variants = 8 calls per config). Actual cost varies strongly with effort tier; treat these as planning ranges, not quotes. basis: observed = measured on our own runs; plan = flat-rate subscription, zero marginal cost; estimated = list-price ballpark, not yet run.",
  "note_zh": "构建本数据集时实测的每次调用美元区间(每 config = N=4 槽位 × 2 提示变体 = 8 次调用)。实际开销随 effort 档位差异极大,仅作预算参考。basis: observed=实测;plan=订阅制零边际成本;estimated=按牌价估算、尚未实跑。",
  "entries": [
    { "family": "gpt", "arm": "api", "per_call_usd": [0.05, 2.0], "basis": "observed",
      "note_en": "Official /responses, background mode. Averaged ~$0.45/call across effort tiers on gpt-5.4 / 5.4-mini / 5.2-codex; xhigh on full-size models reaches ~$2/call. gpt-5.6 family not yet measured, expected higher.",
      "note_zh": "官方 /responses(background 模式)。5.4/5.4-mini/5.2-codex 全档均值约 $0.45/次;大模型 xhigh 档可达 ~$2/次。5.6 系尚未实测,预计更高。" },
    { "family": "grok", "arm": "api", "per_call_usd": [0.02, 0.12], "basis": "observed",
      "note_en": "Official x.ai API: full grok-4.3 + grok-4.5 sweep (64 calls) cost ~$3.1 total.",
      "note_zh": "官方 x.ai API:grok-4.3 + grok-4.5 全档 64 次调用合计约 $3.1。" },
    { "family": "claude", "arm": "CC", "per_call_usd": [0.01, 0.6], "basis": "plan",
      "note_en": "Claude Code harness on a flat-rate plan; the metered-equivalent of our 4-model x 5-effort sweep was ~$64 (fable-5 alone ~$49). Zero marginal cost on plan.",
      "note_zh": "Claude Code harness 走订阅;4 模型 × 5 档扫描的按量等效约 $64(fable-5 独占 ~$49)。订阅内零边际成本。" },
    { "family": "claude", "arm": "api", "per_call_usd": [0.05, 1.0], "basis": "estimated",
      "note_en": "Official Anthropic API not yet run; range projected from Claude Code metered-equivalents.",
      "note_zh": "Anthropic 官方 API 尚未实跑;区间由 Claude Code 按量等效推算。" },
    { "family": "gpt", "arm": "codex-oauth", "per_call_usd": [0, 0], "basis": "plan",
      "note_en": "codex CLI signed into a ChatGPT plan; zero marginal cost.",
      "note_zh": "codex CLI 直登 ChatGPT 订阅;零边际成本。" },
    { "family": "grok", "arm": "grok-cli", "per_call_usd": [0, 0], "basis": "plan",
      "note_en": "grok CLI OAuth subscription; zero marginal cost.",
      "note_zh": "grok CLI OAuth 订阅;零边际成本。" },
    { "family": "multi", "arm": "opencode", "per_call_usd": [0, 0], "basis": "plan",
      "note_en": "opencode go subscription (22 models, CLI harness + gateway api); zero marginal cost.",
      "note_zh": "opencode go 订阅(22 模型,CLI harness + 网关 api);零边际成本。" },
    { "family": "multi", "arm": "go", "per_call_usd": [0, 0], "basis": "plan",
      "note_en": "opencode go gateway api line, same subscription.",
      "note_zh": "opencode go 网关 api,同一订阅。" },
    { "family": "deepseek", "arm": "api", "per_call_usd": [0.001, 0.03], "basis": "estimated",
      "note_en": "Official first-party API list price ballpark; not yet run.",
      "note_zh": "官方第一方 API 牌价估算;尚未实跑。" },
    { "family": "qwen", "arm": "api", "per_call_usd": [0.002, 0.05], "basis": "estimated",
      "note_en": "DashScope first-party list price ballpark; not yet run.",
      "note_zh": "DashScope 第一方牌价估算;尚未实跑。" },
    { "family": "glm", "arm": "api", "per_call_usd": [0.002, 0.05], "basis": "estimated",
      "note_en": "Zhipu first-party list price ballpark; not yet run.",
      "note_zh": "智谱第一方牌价估算;尚未实跑。" },
    { "family": "kimi", "arm": "api", "per_call_usd": [0.002, 0.05], "basis": "estimated",
      "note_en": "Moonshot first-party list price ballpark; not yet run.",
      "note_zh": "月之暗面第一方牌价估算;尚未实跑。" },
    { "family": "gemini", "arm": "api", "per_call_usd": [0.01, 0.3], "basis": "estimated",
      "note_en": "Not yet run (deliberately deferred).",
      "note_zh": "尚未实跑(暂缓)。" }
  ]
}
